Cites;Authors;title;Year;Source;Publisher;ArticleURL;CitesURL;GSRank;QueryDate;Type;DOI;ISSN;CitationURL;Volume;Issue;StartPage;EndPage;ECC;CitesPerYear;CitesPerAuthor;AuthorCount;Age;Abstract;FullTextURL;RelatedURL
3;C Arndt, S Gabriel, S Robinson;assessing the toll of covid-19 lockdown measures on the south african economy;2020;IFPRI book chapters;ideas.repec.org;https://ideas.repec.org/h/fpr/ifpric/133840.html;https://scholar.google.com/scholar?cites=9574650312885827554&as_sdt=2005&sciodt=2007&hl=en;17;16.12.2021 01:40;;;;;;;;;3;300;1;3;1;In trying to limit the spread of COVID-19, policymakers are confronting the difficult task of balancing the positive health effects of lockdowns against their economic costs â€” particularly the burdens imposed on low-income and food-insecure households. South …;;https://scholar.google.com/scholar?q=related:4nckHLv934QJ:scholar.google.com/&scioq=intitle:%22covid+19%22+intitle:lockdown+intitle:economy&hl=en&as_sdt=2007
3;S Roy, N Chowdhury, MMM Bhuyan;covid-19 induced lockdown consequences on air quality and economy-a case study of bangladesh;2020;Journal of Environment …;researchgate.net;https://www.researchgate.net/profile/Nasrin-Chowdhury/publication/348994518_COVID-19_Induced_Lockdown_Consequences_on_Air_Quality_and_Economy_-A_Case_Study_of_Bangladesh/links/601a5bc192851c4ed545f9e9/COVID-19-Induced-Lockdown-Consequences-on-Air-Quality-and-Economy-A-Case-Study-of-Bangladesh.pdf;https://scholar.google.com/scholar?cites=15066365871895294104&as_sdt=2005&sciodt=2007&hl=en;32;16.12.2021 01:40;PDF;;;;;;;;3;300;1;3;1;The present study involves the investigation of air quality of Dhaka city, Bangladesh, before and during the periods of lockdown imposed to reduce the spread of a novel coronavirus (COVID-19) and comparison of data in corresponding periods of two previous years. Further …;https://www.researchgate.net/profile/Nasrin-Chowdhury/publication/348994518_COVID-19_Induced_Lockdown_Consequences_on_Air_Quality_and_Economy_-A_Case_Study_of_Bangladesh/links/601a5bc192851c4ed545f9e9/COVID-19-Induced-Lockdown-Consequences-on-Air-Quality-and-Economy-A-Case-Study-of-Bangladesh.pdf;https://scholar.google.com/scholar?q=related:mDBjeu97FtEJ:scholar.google.com/&scioq=intitle:%22covid+19%22+intitle:lockdown+intitle:economy&hl=en&as_sdt=2007
3;D Paul;covid-19 impact of the lockdown in the indian economy;2020;… of Symbiosis International (Deemed University https …;;;https://scholar.google.com/scholar?cites=1289260892648071609&as_sdt=2005&sciodt=2007&hl=en;53;16.12.2021 01:40;CITATION;;;;;;;;3;300;3;1;1;;;https://scholar.google.com/scholar?q=related:uWEXefNf5BEJ:scholar.google.com/&scioq=intitle:%22covid+19%22+intitle:lockdown+intitle:economy&hl=en&as_sdt=2007
3;S Gukurume, M Oosterom;the impact of the covid-19 lockdown on zimbabwes informal economy;2020;Brighton: Sussex Institute of Development Studies (IDS …;;;https://scholar.google.com/scholar?cites=5011909104162269546&as_sdt=2005&sciodt=2007&hl=en;61;16.12.2021 01:40;CITATION;;;;;;;;3;300;2;2;1;;;
3;A Pinto, A Bhowmick, R Adlakha;how did indias rural economy fare through the covid-19 lockdown and the re-opening;2020;Report, World Bank;;;https://scholar.google.com/scholar?cites=2482846651751706764&as_sdt=2005&sciodt=2007&hl=en;66;16.12.2021 01:40;CITATION;;;;;;;;3;300;1;3;1;;;https://scholar.google.com/scholar?q=related:jLBtBeDXdCIJ:scholar.google.com/&scioq=intitle:%22covid+19%22+intitle:lockdown+intitle:economy&hl=en&as_sdt=2007
3;B Mehta, K Arjun;covid-19 and the lockdown impact estimating the unemployment and job losses in indias informal economy;2020;Times Of India Blog;;;https://scholar.google.com/scholar?cites=1773471877702602416&as_sdt=2005&sciodt=2007&hl=en;68;16.12.2021 01:40;CITATION;;;;;;;;3;300;2;2;1;;;https://scholar.google.com/scholar?q=related:sM6byUajnBgJ:scholar.google.com/&scioq=intitle:%22covid+19%22+intitle:lockdown+intitle:economy&hl=en&as_sdt=2007
2;N González-Pampillón, G Nunez-Chaim, K Ziegler;recovering from the first covid-19 lockdown economic impacts of the uks eat out to help out scheme;2021;;cep.lse.ac.uk;https://cep.lse.ac.uk/pubs/download/cepcovid-19-018.pdf;https://scholar.google.com/scholar?cites=7249079174516933084&as_sdt=2005&sciodt=2007&hl=en;27;16.12.2021 01:42;BOOK;;;;;;;;2;200;1;3;1;Summary? The hospitality sector was particularly hard-hit by restrictions introduced to stop the spread of COVID-19. The Eat Out to Help Out (EOTHO) scheme–implemented in August 2020 after the 1st national lockdown had ended–aimed to boost demand and protect jobs in …;https://cep.lse.ac.uk/pubs/download/cepcovid-19-018.pdf;https://scholar.google.com/scholar?q=related:3IHDGRrnmWQJ:scholar.google.com/&scioq=intitle:%22covid+19%22+intitle:lockdown+intitle:economic&hl=en&as_sdt=2007
2;B Nayak, SS Bhattacharyya, S Goswami, ...;adoption of online education channel during the covid-19 pandemic and associated economic lockdown an empirical study from push–pull-mooring ;2021;Journal of Computers in …;Springer;https://link.springer.com/article/10.1007/s40692-021-00193-w;https://scholar.google.com/scholar?cites=8771848398534395829&as_sdt=2005&sciodt=2007&hl=en;29;16.12.2021 01:42;HTML;10.1007/s40692-021-00193-w;;;;;;;2;200;1;4;1;The purpose of the research was to study how the onset of COVID-19 pandemic fuelled shift towards digitalization in the education ecosystem. The study consisted of responses from 316 engineering students collected during the COVID-19 pandemic physical lockdown in …;https://link.springer.com/article/10.1007/s40692-021-00193-w;https://scholar.google.com/scholar?q=related:tcc4qqTdu3kJ:scholar.google.com/&scioq=intitle:%22covid+19%22+intitle:lockdown+intitle:economic&hl=en&as_sdt=2007
2;M Rahaman, R Khatun;socio-economic profile challenges and emergency assistance during the covid-19 lockdown a case study on household industry workers in murshidabad ;2021;IMCC Journal of Science;myjournal.imcc.edu.ph;https://myjournal.imcc.edu.ph/publication/volume-1-issue-1-2021/household-industry-workers-in-india-covid19-lockdown/;https://scholar.google.com/scholar?cites=17102884214620419763&as_sdt=2005&sciodt=2007&hl=en;44;16.12.2021 01:42;;;;;;;;;2;200;1;2;1;COVID-19 lockdown causes severe socio-economic vulnerability among the household industry workers (HIWs) in India. In this study, the socio-economic profile, challenges, and emergency assistance received by these workers during the COVID-19 lockdown were …;https://myjournal.imcc.edu.ph/wp-content/uploads/2021/05/IJS2021_020_Household-Industry-Workers-in-India.pdf;https://scholar.google.com/scholar?q=related:s_YVB5SmWe0J:scholar.google.com/&scioq=intitle:%22covid+19%22+intitle:lockdown+intitle:economic&hl=en&as_sdt=2007
2;YT Chen, YF Yen, SH Yu, E Chia-Yu Su;a flexible lockdown by integrating public health and economic reactivation to response the crisis of covid-19 responses to comments by alvaro j idrovo on an ;2020;International journal of …;mdpi.com;https://www.mdpi.com/877606;https://scholar.google.com/scholar?cites=14279496721344748837&as_sdt=2005&sciodt=2007&hl=en;35;16.12.2021 01:42;;;;;;;;;2;200;1;4;1;We greatly appreciate Idrovo's comments on our research and wish to specifically respond to his comments. Idrovo indicates that rapid increases in the number of confirmed cases in the past few weeks were observed in Latin America, where some countries had …;https://www.mdpi.com/1660-4601/17/21/8068/htm;https://scholar.google.com/scholar?q=related:Jd0br5z2KsYJ:scholar.google.com/&scioq=intitle:%22covid+19%22+intitle:lockdown+intitle:economic&hl=en&as_sdt=2007
2;R Fitriyah, S Melinda;to lockdown or to not lockdown economic and human life dilemma in covid-19 pandemic;2020;Agregat: Jurnal Ekonomi dan Bisnis;journal.uhamka.ac.id;https://journal.uhamka.ac.id/index.php/agregat/article/view/6210;https://scholar.google.com/scholar?cites=14349081019596831399&as_sdt=2005&sciodt=2007&hl=en;56;16.12.2021 01:42;;;;;;;;;2;200;1;2;1;Covid-19 pandemic has been a concern all over the world, including Indonesia. Various parties have been pressing government to do the total lockdown, as they see total lockdown is very crucial to save the citizens' lives. Indonesia Government firmly opposed this …;https://journal.uhamka.ac.id/index.php/agregat/article/download/6210/2148;https://scholar.google.com/scholar?q=related:p3peoiktIscJ:scholar.google.com/&scioq=intitle:%22covid+19%22+intitle:lockdown+intitle:economic&hl=en&as_sdt=2007
2;E Alvarez Fernando, A David, L Francesco;a simple planning problem for covid-19 lockdown national bureau of economic research;2020;;WP;;https://scholar.google.com/scholar?cites=3171625168466141728&as_sdt=2005&sciodt=2007&hl=en;109;16.12.2021 01:42;CITATION;;;;;;;;2;200;1;3;1;;;https://scholar.google.com/scholar?q=related:IOIcZ0ngAywJ:scholar.google.com/&scioq=intitle:%22covid+19%22+intitle:lockdown+intitle:economic&hl=en&as_sdt=2007
2;FE Alvarez, D Argente, F Lippi;a simple planning problem for covid-19 lockdown national bureau of economic research working paper 26981;2020;;;;https://scholar.google.com/scholar?cites=14014651802521253990&as_sdt=2005&sciodt=2007&hl=en;110;16.12.2021 01:42;CITATION;;;;;;;;2;200;1;3;1;;;https://scholar.google.com/scholar?q=related:ZjgRxI8LfsIJ:scholar.google.com/&scioq=intitle:%22covid+19%22+intitle:lockdown+intitle:economic&hl=en&as_sdt=2007
2;? Principato, L Secondi, C Cicatiello, M Giovanni;caring more about food the unexpected positive effect of the covid-19 lockdown on household food management and waste socio-economic ;2020;Article;;;https://scholar.google.com/scholar?cites=5575526867960221093&as_sdt=2005&sciodt=2007&hl=en;112;16.12.2021 01:42;CITATION;;;;;;;;2;200;1;4;1;;;
2;V Rawal, M Kumar, A Verma, J Pais;covid-19 lockdown impact on agriculture and the rural economy society for social and economic research working paper no s3/209;2020;;;;https://scholar.google.com/scholar?cites=314037193308088448&as_sdt=2005&sciodt=2007&hl=en;113;16.12.2021 01:42;CITATION;;;;;;;;2;200;1;4;1;;;https://scholar.google.com/scholar?q=related:gKhj2SmvWwQJ:scholar.google.com/&scioq=intitle:%22covid+19%22+intitle:lockdown+intitle:economic&hl=en&as_sdt=2007
2;A Ismail;russias economic outlook following the covid-19 coronavirus lockdown and the fall in oil prices;2020;May, Russia's Economic;;;https://scholar.google.com/scholar?cites=10896053517130626500&as_sdt=2005&sciodt=2007&hl=en;117;16.12.2021 01:42;CITATION;;;;;;;;2;200;2;1;1;;;https://scholar.google.com/scholar?q=related:xHU3rvGONpcJ:scholar.google.com/&scioq=intitle:%22covid+19%22+intitle:lockdown+intitle:economic&hl=en&as_sdt=2007
2;R Subramanya;covid-19 total lockdown an economic and humanitarian disaster;2020;India Matters;;;https://scholar.google.com/scholar?cites=7089276570105367531&as_sdt=2005&sciodt=2007&hl=en;119;16.12.2021 01:42;CITATION;;;;;;;;2;200;2;1;1;;;https://scholar.google.com/scholar?q=related:60uh23orYmIJ:scholar.google.com/&scioq=intitle:%22covid+19%22+intitle:lockdown+intitle:economic&hl=en&as_sdt=2007
2;CK Abraham, S Emmanuel;economic impact of covid-19 and lockdown on middle income agriculturists;2020;Purakala UGC Care Journal;;;https://scholar.google.com/scholar?cites=8609671722626590368&as_sdt=2005&sciodt=2007&hl=en;120;16.12.2021 01:42;CITATION;;;;;;;;2;200;1;2;1;;;https://scholar.google.com/scholar?q=related:oCbi09Cye3cJ:scholar.google.com/&scioq=intitle:%22covid+19%22+intitle:lockdown+intitle:economic&hl=en&as_sdt=2007
2;O Karin, YM Bar-On, T Milo, I Katzir, A Mayo, ...;adaptive cyclic exit strategies from lockdown to suppress covid-19 and allow economic activity medrxiv;2020;;Cold Spring Harbor Laboratory …;;https://scholar.google.com/scholar?cites=15691297167792269866&as_sdt=2005&sciodt=2007&hl=en;121;16.12.2021 01:42;CITATION;;;;;;;;2;200;0;6;1;;;https://scholar.google.com/scholar?q=related:KupZV6OvwtkJ:scholar.google.com/&scioq=intitle:%22covid+19%22+intitle:lockdown+intitle:economic&hl=en&as_sdt=2007
2;A Bhuiyan, N Sakib, AH Pakpour;gri ths md  mamun ma 2020 covid-19-related suicides in bangladesh due to lockdown and economic factors case study evidence from media ;;International Journal of Mental Health and Addiction …;;;https://scholar.google.com/scholar?cites=15962561676634707686&as_sdt=2005&sciodt=2007&hl=en;118;16.12.2021 01:42;CITATION;;;;;;;;2;0;1;3;;;;https://scholar.google.com/scholar?q=related:5lYTiUVpht0J:scholar.google.com/&scioq=intitle:%22covid+19%22+intitle:lockdown+intitle:economic&hl=en&as_sdt=2007
2;O Karin, YM Bar-On, T Milo, I Katzir, A Mayo, Y Korem;cyclic exit strategies from lockdown to supress covid-19 and allow economic activity medrxiv 2020;;;;;https://scholar.google.com/scholar?cites=17261371203690785474&as_sdt=2005&sciodt=2007&hl=en;122;16.12.2021 01:42;CITATION;;;;;;;;2;0;0;6;;;;https://scholar.google.com/scholar?q=related:wmoltKe1jO8J:scholar.google.com/&scioq=intitle:%22covid+19%22+intitle:lockdown+intitle:economic&hl=en&as_sdt=2007
2;MA Malek, T Sonobe, HT Truong;changes in the rural economy in bangladesh under covid-19 lockdown measures evidence from a phone survey of mahbub hossain sample households;2021;;papers.ssrn.com;https://papers.ssrn.com/sol3/papers.cfm?abstract_id=3912353;https://scholar.google.com/scholar?cites=4438589176686265873&as_sdt=2005&sciodt=2007&hl=en;15;16.12.2021 01:40;;;;;;;;;2;200;1;3;1;We offer a comprehensive picture of the rural economy in Bangladesh during the first three months of the lockdown period in comparison with the pre-COVID-19 situation. Using a nationally representative sample (of 2,312 rural households from 62 villages in 56 districts) …;https://www.adb.org/sites/default/files/publication/689246/adbi-wp1235.pdf;https://scholar.google.com/scholar?q=related:EUZH7FYJmT0J:scholar.google.com/&scioq=intitle:%22covid+19%22+intitle:lockdown+intitle:economy&hl=en&as_sdt=2007
2;H Ahamed, KT Hasan, MT Islam, ...;lockdown policy dilemma covid-19 pandemic versus economy and mental health;2020;Journal of Biomedical …;jbiomedanalytics.org;https://jbiomedanalytics.org/index.php/biomed/article/view/60;https://scholar.google.com/scholar?cites=2908132243883526315&as_sdt=2005&sciodt=2007&hl=en;12;16.12.2021 01:40;;;;;;;;;2;200;1;4;1;Lockdown is considered to be the best of policies around the world to fight the deadly virus of COVID-19 which decimated hundreds of people in the last six months. However, this is not a cost-free measure. Billions of dollars worth of economic activities halted hinging upon …;https://jbiomedanalytics.org/index.php/biomed/article/download/60/29;https://scholar.google.com/scholar?q=related:q4iJLN7CWygJ:scholar.google.com/&scioq=intitle:%22covid+19%22+intitle:lockdown+intitle:economy&hl=en&as_sdt=2007
2;KK Mandal, S Alam, A Ranjan, ...;a review of indias response to covid-19 outbreak and the impact of lockdown on the indian economy;2020;Journal of Critical …;Innovare Academics Sciences;;https://scholar.google.com/scholar?cites=8533216595165146793&as_sdt=2005&sciodt=2007&hl=en;28;16.12.2021 01:40;CITATION;;;;;;;;2;200;1;4;1;;https://www.researchgate.net/profile/Kajal-Mandal/publication/342480577_A_Review_of_India's_Response_to_COVID-19_Outbreak_and_the_Impact_of_Lockdown_on_the_Indian_Economy/links/5f03e955299bf1881607d101/A-Review-of-Indias-Response-to-COVID-19-Outbreak-and-the-Impact-of-Lockdown-on-the-Indian-Economy.pdf;https://scholar.google.com/scholar?q=related:qW5JSkgTbHYJ:scholar.google.com/&scioq=intitle:%22covid+19%22+intitle:lockdown+intitle:economy&hl=en&as_sdt=2007
2;T Kanitkar;the covid-19 lockdown in india impacts on the economy and the power sector glob transitions 2 150–156 2020;2020;;;;https://scholar.google.com/scholar?cites=3486879035194734567&as_sdt=2005&sciodt=2007&hl=en;63;16.12.2021 01:40;CITATION;;;;;;;;2;200;2;1;1;;;
2;VK Rawal;m verma a and pais j2020 covid–19 lockdown impact on agriculture and rural economy;;Society for Social and Economic Research;;;https://scholar.google.com/scholar?cites=3720857293353755547&as_sdt=2005&sciodt=2007&hl=en;64;16.12.2021 01:40;CITATION;;;;;;;;2;0;2;1;;;;
1;M Hüther, H Bardt;an economic policy exit strategy from the corona lockdown;2020;Wirtschaftsdienst (Hamburg, Germany: 1949);europepmc.org;https://europepmc.org/article/med/32336804;https://scholar.google.com/scholar?cites=5535995879883323702&as_sdt=2005&sciodt=2007&hl=en;1;16.12.2021 02:09;;;;;;;;;1;100;1;2;1;The fight against the coronavirus pandemic has led to an insulation of social and economic life and will have considerable economic consequences. Important areas of the industry and service sectors were partially or completely shutdown. A resumption of activity should …;https://scholar.google.com/scholar?output=instlink&q=info:Nrl4-uvO00wJ:scholar.google.com/&hl=en&as_sdt=2007&scillfp=9699343358451843702&oi=lle;https://scholar.google.com/scholar?q=related:Nrl4-uvO00wJ:scholar.google.com/&scioq=intitle:corona+intitle:lockdown+intitle:economic&hl=en&as_sdt=2007
1;JC Kanmony;health and economic impacts of corona and corona-related lockdown on india;2020;International Journal of Clinical and Experimental …;hillpublisher.com;http://www.hillpublisher.com/UpFile/202007/20200714151652.pdf;https://scholar.google.com/scholar?cites=1298998249759211271&as_sdt=2005&sciodt=2007&hl=en;2;16.12.2021 02:09;PDF;;;;;;;;1;100;1;1;1;Occurrence of pandemics is not new to the world. In the world, four pandemics have occurred recently. They are: Spanish flu (1918), Asian flu (1957), Hong Kong flu (1968), and Swine flu (2009). The origin of three of the four pandemics, apart from the “Black Death” that …;http://www.hillpublisher.com/UpFile/202007/20200714151652.pdf;https://scholar.google.com/scholar?q=related:B3_AmAb4BhIJ:scholar.google.com/&scioq=intitle:corona+intitle:lockdown+intitle:economic&hl=en&as_sdt=2007
1;E Torre, GL Colombo, S Di Matteo, ...;economic impact of covid-19 lockdown on italian nhs focus on diabetes mellitus;2021;ClinicoEconomics …;ncbi.nlm.nih.gov;https://www.ncbi.nlm.nih.gov/pmc/articles/pmc8213950/;https://scholar.google.com/scholar?cites=15840504126394852134&as_sdt=2005&sciodt=2007&hl=en;36;16.12.2021 01:42;HTML;;;;;;;;1;100;0;4;1;Background In Italy, the adoption of a total lockdown has generated almost total suspension of outpatient visits except for emergencies. Even after lockdown, the pandemic fear created additional barriers to access the health services. The aim of our study is to evaluate the …;https://www.ncbi.nlm.nih.gov/pmc/articles/pmc8213950/;https://scholar.google.com/scholar?q=related:JuPfjJPG1NsJ:scholar.google.com/&scioq=intitle:%22covid+19%22+intitle:lockdown+intitle:economic&hl=en&as_sdt=2007
1;D Kovács, H Kamill;lockdown effect as anti-covid-19 measure on atmospheric pollutants revealing economic contributions in medium-sized cities 10 urban areas of grand est ;2021;Sustainable Cities and Society;pesquisa.bvsalud.org;https://pesquisa.bvsalud.org/global-literature-on-novel-coronavirus-2019-ncov/resource/pt/covidwho-1309387;https://scholar.google.com/scholar?cites=16597287453956442700&as_sdt=2005&sciodt=2007&hl=en;46;16.12.2021 01:42;;;;;;;;;1;100;1;2;1;This study investigates with Sentinel-5P data the magnitude of the change in the concentration of air pollutants (NO2, HCHO, SO2, O3, CO, and aerosol index) in the air of ten cities and urban areas of the French region of Grand Est as a result of the first lockdown …;;
1;SS Bhattacharyya, PV Mandke;  adoption and experience of telemedicine technology services perspectives during coronavirus covid-19 pandemic crisis and associated economic lockdown in ;2021;Journal of Science and Technology …;emerald.com;https://www.emerald.com/insight/content/doi/10.1108/JSTPM-10-2020-0146/full/html;https://scholar.google.com/scholar?cites=12532877340371627431&as_sdt=2005&sciodt=2007&hl=en;54;16.12.2021 01:42;;10.1108/JSTPM-10-2020-0146;;;;;;;1;100;1;2;1;Purpose The purpose of this paper is to study the phenomenon of abrupt shift by both doctors and patients to telemedicine during the coronavirus (COVID-19) pandemic and associated economic lockdown in India. The study explored various drivers of telemedicine …;;https://scholar.google.com/scholar?q=related:p61k_om57a0J:scholar.google.com/&scioq=intitle:%22covid+19%22+intitle:lockdown+intitle:economic&hl=en&as_sdt=2007
1;S Robinson, S Levy, V Hernandez, R Davies, ...;modelling the economic impact of the covid-19 pandemic and lockdown policies a structural simulation model applied to four countries;2021;;gtap.agecon.purdue.edu;https://www.gtap.agecon.purdue.edu/resources/res_display.asp?RecordID=6228;https://scholar.google.com/scholar?cites=18366897273886438035&as_sdt=2005&sciodt=2007&hl=en;82;16.12.2021 01:42;;;;;;;;;1;100;0;5;1;This paper considers different approaches to modelling the economic impact of the Covid-19 pandemic/lockdown shocks. We review different modelling strategies and argue that, given the nature of the bottom-up recession caused by the pandemic/lockdowns, simulation …;;
1;M Coccia;national lockdown to cope with covid-19 pandemic effects contradictory on public health and negative on economic system;2020;;researchsquare.com;https://www.researchsquare.com/article/rs-115665/latest.pdf;https://scholar.google.com/scholar?cites=17820224384096688762&as_sdt=2005&sciodt=2007&hl=en;33;16.12.2021 01:42;PDF;;;;;;;;1;100;1;1;1;One of the policy responses to cope with effects of COVID-19 pandemic in society is the national lockdown applied by many countries worldwide. Literature lacks of studies that show whether the effects of this public policy on public health, environment and …;https://www.researchsquare.com/article/rs-115665/latest.pdf;https://scholar.google.com/scholar?q=related:elrWZ6knTvcJ:scholar.google.com/&scioq=intitle:%22covid+19%22+intitle:lockdown+intitle:economic&hl=en&as_sdt=2007
1;JM Claverie;a scenario to safely ease the covid-19 lockdown while allowing economic recovery;2020;Virologie;igs.cnrs-mrs.fr;https://www.igs.cnrs-mrs.fr/wp-content/uploads/2020/09/vir-316971-45454-a_scenario_English-1.pdf;https://scholar.google.com/scholar?cites=1820705420064006407&as_sdt=2005&sciodt=2007&hl=en;49;16.12.2021 01:42;PDF;;;;;;;;1;100;1;1;1;If they work as expected, the strict containment measures enforced to stop the French Covid-19 epidemic will leave a large proportion of the population “naive” about the SARS-CoV-2 virus. In these conditions, how can we prevent the epidemic from rebounding, at a time when …;https://www.igs.cnrs-mrs.fr/wp-content/uploads/2020/09/vir-316971-45454-a_scenario_English-1.pdf;https://scholar.google.com/scholar?q=related:ByGL2-5xRBkJ:scholar.google.com/&scioq=intitle:%22covid+19%22+intitle:lockdown+intitle:economic&hl=en&as_sdt=2007
1;R Pongou, G Tchuente, JB Tondji;an economic model of health-vs-wealth prioritization during covid-19 optimal lockdown network centrality and segregation;2020;Network Centrality, and …;papers.ssrn.com;https://papers.ssrn.com/sol3/papers.cfm?abstract_id=3695363;https://scholar.google.com/scholar?cites=15497434510135495247&as_sdt=2005&sciodt=2007&hl=en;51;16.12.2021 01:42;;;;;;;;;1;100;0;3;1;We address the problem of finding the optimal lockdown and reopening policy during a pandemic like COVID-19, for a social planner who prioritizes health over short-term wealth accumulation. Agents are connected through a fuzzy network of contacts, and the planner's …;https://scholarworks.utrgv.edu/cgi/viewcontent.cgi?article=1106&context=ef_fac;https://scholar.google.com/scholar?q=related:T4qB-pPyEdcJ:scholar.google.com/&scioq=intitle:%22covid+19%22+intitle:lockdown+intitle:economic&hl=en&as_sdt=2007
1;P Paul, K Banerjee;exploring the economic impact of covid-19 induced lockdown-a study with special reference to some selected industries in india;2020;The Management Accountant Journal;icmai-rnj.in;http://www.icmai-rnj.in/index.php/maj/article/view/154026;https://scholar.google.com/scholar?cites=16935597746507928054&as_sdt=2005&sciodt=2007&hl=en;59;16.12.2021 01:42;;;;;;;;;1;100;1;2;1;This paper deals with the economic impact of COVID-19 which shattered the lives and livelihoods of people throughout the world causing unimaginable and unexplainable plights and miseries to the humankind specially the millions of people of lower-income group and …;;https://scholar.google.com/scholar?q=related:9tGC-2tUB-sJ:scholar.google.com/&scioq=intitle:%22covid+19%22+intitle:lockdown+intitle:economic&hl=en&as_sdt=2007
1;D De Mel, A Kapilan;facing a second wave of covid-19 in sri lanka economic cost of a lockdown strategy;2020;;archive.veriteresearch.org;https://archive.veriteresearch.org/xmlui/handle/123456789/3147;https://scholar.google.com/scholar?cites=15501524812186018509&as_sdt=2005&sciodt=2007&hl=en;61;16.12.2021 01:42;;;;;;;;;1;100;1;2;1;As of August 2020, Sri Lanka is currently in the post-lockdown stage of the COVID-19 pandemic. Due to the surge in the number of infections in mid-March, the country was forced into a complete lockdown with all-day curfews-imposed island wide. The lockdown was in …;;https://scholar.google.com/scholar?q=related:zWJAo696INcJ:scholar.google.com/&scioq=intitle:%22covid+19%22+intitle:lockdown+intitle:economic&hl=en&as_sdt=2007
1;G Bora;for indian gaming startups covid-19 lockdown is a boon for business the economic times april 13 retrieved june 24 2020;2020;;;;https://scholar.google.com/scholar?cites=10016343645562322711&as_sdt=2005&sciodt=2007&hl=en;123;16.12.2021 01:42;CITATION;;;;;;;;1;100;1;1;1;;;
1;RQ Grafton, J Parslow, T Kompas, K Glass, E Banks, ...;health and economic effects of covid-19 control in australia modelling and quantifying the payoffs of hard versus soft lockdown medrxiv 2020;;Google Scholar;;;https://scholar.google.com/scholar?cites=9914480973327898684&as_sdt=2005&sciodt=2007&hl=en;124;16.12.2021 01:42;CITATION;;;;;;;;1;0;0;6;;;;
