Cites;Authors;title;Year;Source;Publisher;ArticleURL;CitesURL;GSRank;QueryDate;Type;DOI;ISSN;CitationURL;Volume;Issue;StartPage;EndPage;ECC;CitesPerYear;CitesPerAuthor;AuthorCount;Age;Abstract;FullTextURL;RelatedURL
0;M Coccia;the effect of lockdown on public health and economic system findings from first wave of the covid-19 pandemic for designing effective strategies to cope with ;2020;;researchgate.net;https://www.researchgate.net/profile/Mario-Coccia/publication/346602536_The_Effect_of_Lockdown_on_Public_Health_and_Economic_System_Findings_from_First_Wave_of_the_COVID-19_Pandemic_for_Designing_Effective_Strategies_to_Cope_with_Future_Waves/links/5ff41f67299bf140887035ae/The-Effect-of-Lockdown-on-Public-Health-and-Economic-System-Findings-from-First-Wave-of-the-COVID-19-Pandemic-for-Designing-Effective-Strategies-to-Cope-with-Future-Waves.pdf;;48;16.12.2021 01:42;PDF;;;;;;;;0;0;0;1;1;One of the fundamental problems in the COVID-19 pandemic crisis is the critical decision of introducing or not wide social restrictions, such as national lockdown, with the expectation of reducing the final impact of the novel coronavirus in society. This study analyzes, in an …;https://www.researchgate.net/profile/Mario-Coccia/publication/346602536_The_Effect_of_Lockdown_on_Public_Health_and_Economic_System_Findings_from_First_Wave_of_the_COVID-19_Pandemic_for_Designing_Effective_Strategies_to_Cope_with_Future_Waves/links/5ff41f67299bf140887035ae/The-Effect-of-Lockdown-on-Public-Health-and-Economic-System-Findings-from-First-Wave-of-the-COVID-19-Pandemic-for-Designing-Effective-Strategies-to-Cope-with-Future-Waves.pdf;https://scholar.google.com/scholar?q=related:2PFiLsbyFWoJ:scholar.google.com/&scioq=intitle:%22covid+19%22+intitle:lockdown+intitle:economic&hl=en&as_sdt=2007
0;Y Guntupalli, AJ Priya, KG Mohanraj, ...;economic declination due to covid-19 lockdown-a review;2020;European Journal of …;ejmcm.com;https://ejmcm.com/article_2681.html;;66;16.12.2021 01:42;;;;;;;;;0;0;0;4;1;COVID 19 is a strain of coronavirus which is virulent and spreads easily among humans. It has become a pandemic and has caused a global emergency. Though the death rate is not that high it is still considered dangerous. It has caused a huge impact on the global …;https://ejmcm.com/article_2681_0029720effb66a60837b3f5a1301433c.pdf;https://scholar.google.com/scholar?q=related:zgxP7aLyltsJ:scholar.google.com/&scioq=intitle:%22covid+19%22+intitle:lockdown+intitle:economic&hl=en&as_sdt=2007
0;S Soyiyo, J Tengatenga, BA Mosiwa;the fear of economic impacts of covid-19 and publics response to lockdown measures in malawi;2020;Journal of Public …;journals.co.za;https://journals.co.za/doi/abs/10.10520/ejc-jpad-v55-n3-1-a10;;70;16.12.2021 01:42;;10.10520/ejc-jpad-v55-n3-1-a10;;;;;;;0;0;0;3;1;Lockdowns have been adopted widely by different countries to contain the spread of COVID-19 and reduce pressure on health systems. When Malawi announced a 21-day lockdown, the public protested, and a court injunction stopped the lockdown. Why were Malawians …;https://www.researchgate.net/profile/Bethuel-Ngcamu/publication/350467095_Municipal_Corruption_in_the_Era_of_a_COVID-19_Pandemic_Four_South_African_Case_Studies/links/613dc4204e1df271062f2259/Municipal-Corruption-in-the-Era-of-a-COVID-19-Pandemic-Four-South-African-Case-Studies.pdf#page=114;https://scholar.google.com/scholar?q=related:EYfyi79V0eUJ:scholar.google.com/&scioq=intitle:%22covid+19%22+intitle:lockdown+intitle:economic&hl=en&as_sdt=2007
0;R Gani, L Brown, R Kapoor;pin34 covid 19–what is the health-economic economically justifiable price of lockdown;2020;Value in Health;valueinhealthjournal.com;https://www.valueinhealthjournal.com/article/S1098-3015(20)33131-4/abstract;;72;16.12.2021 01:42;;;;;;;;;0;0;0;3;1;Objectives Many European governments have imposed emergency lockdown measures to reduce interpersonal contact and slow the spread of COVID 19. This has led to substantial reductions in transmission rates and burden of disease but at a very high economic cost …;;
0;V Jha, TA Dinesh;economic impact of covid-19 on ophthalmic care–post lockdown models;2020;Journal of the Social Sciences;researchgate.net;https://www.researchgate.net/profile/Vidya-Jha/publication/343229817_Economic_impact_of_COVID-19_on_ophthalmic_care_-Post_lockdown_models/links/5f1e769ca6fdcc9626b6809e/Economic-impact-of-COVID-19-on-ophthalmic-care-Post-lockdown-models.pdf;;73;16.12.2021 01:42;PDF;;;;;;;;0;0;0;2;1;The healthcare sector is witnessing an unprecedented and global challenge of COVID-19 outbreak. It is considered as the most devastating public health crisis and the most significant geopolitical event of this generation. Impact on society, economy and …;https://www.researchgate.net/profile/Vidya-Jha/publication/343229817_Economic_impact_of_COVID-19_on_ophthalmic_care_-Post_lockdown_models/links/5f1e769ca6fdcc9626b6809e/Economic-impact-of-COVID-19-on-ophthalmic-care-Post-lockdown-models.pdf;https://scholar.google.com/scholar?q=related:TC4nsBegneYJ:scholar.google.com/&scioq=intitle:%22covid+19%22+intitle:lockdown+intitle:economic&hl=en&as_sdt=2007
0;B Mukhopadhyay;economic recovery post covid-19 centralised vs decentralised lockdown;2020;Available at SSRN 3660848;researchgate.net;https://www.researchgate.net/profile/Bappaditya-Mukhopadhyay/publication/343218832_Economic_Recovery_Post_COVID-19_Centralised_vs_Decentralised_Lockdown/links/5f1d0502a6fdcc9626b386b1/Economic-Recovery-Post-COVID-19-Centralised-vs-Decentralised-Lockdown.pdf;;78;16.12.2021 01:42;PDF;;;;;;;;0;0;0;1;1;To arrest the spread of COVID-19, most countries have imposed some form of lockdown to ensure social distancing. For India, the lockdown was over four phases and over two months. While, the effectiveness of such a stringent measure is yet to be established, some …;https://www.researchgate.net/profile/Bappaditya-Mukhopadhyay/publication/343218832_Economic_Recovery_Post_COVID-19_Centralised_vs_Decentralised_Lockdown/links/5f1d0502a6fdcc9626b386b1/Economic-Recovery-Post-COVID-19-Centralised-vs-Decentralised-Lockdown.pdf;https://scholar.google.com/scholar?q=related:Oh_BTpdtdSwJ:scholar.google.com/&scioq=intitle:%22covid+19%22+intitle:lockdown+intitle:economic&hl=en&as_sdt=2007
0;AY Muhammed, M Adenike, ...;the impact of covid-19 lockdown on socio-economic activities in kaduna state nigeria;2020;Journal of Sustainable …;scholar.archive.org;https://scholar.archive.org/work/xxccidscb5cp5paopskjggnlym/access/wayback/https://goodwoodpub.com/index.php/JoSTE/article/download/547/161;;80;16.12.2021 01:42;PDF;;;;;;;;0;0;0;3;1;Abstract Purpose: Coronavirus (Covid-19) pandemic affects social and economic activities all over the world. This study analyses the impact of lockdown caused by the pandemic in Kaduna State, Nigeria, so that the public can appreciate it and take adequate measures to …;https://scholar.archive.org/work/xxccidscb5cp5paopskjggnlym/access/wayback/https://goodwoodpub.com/index.php/JoSTE/article/download/547/161;https://scholar.google.com/scholar?q=related:2MLx4eGFF6AJ:scholar.google.com/&scioq=intitle:%22covid+19%22+intitle:lockdown+intitle:economic&hl=en&as_sdt=2007
0;YA SOYE, OT Maliki;covid-19 pandemic lockdown its economic shock on insurance business in nigeria;2020;;eprints.federalpolyilaro.edu.ng;http://eprints.federalpolyilaro.edu.ng/1339/;;83;16.12.2021 01:42;;;;;;;;;0;0;0;2;1;The sudden outbreak of the pandemic Covid-19 novel has led many organizations to the adoption of unprepared for strategies for the survival of their entities due to the shock posed by the corona virus on their routine business. On this note this study bordered on the …;http://eprints.federalpolyilaro.edu.ng/1339/1/SOYE%20%26%20MALIKI%20Conference.docx;https://scholar.google.com/scholar?q=related:fUbRtRtt1lgJ:scholar.google.com/&scioq=intitle:%22covid+19%22+intitle:lockdown+intitle:economic&hl=en&as_sdt=2007
0;DS Fabio, R Alessandro;the lockdown of economic activities during the covid-19 pandemic supply chains and territorial relationships through a network contracts analysis;2020;Rivista economica del Mezzogiorno;ideas.repec.org;https://ideas.repec.org/a/mul/jqyfkm/doi10.1432-99054y2020i3p415-436.html;;90;16.12.2021 01:42;;;;;;;;;0;0;0;2;1;The lockdown phase of the Italian economy, determined by the authorization/suspension of activities for companies belonging to specific sectors implemented with several decrees of the Prime Minister to prevent the spread of the COVID-19 pandemic, has raised the issue of …;;
0;S Schiman;second covid-19 lockdown dampens economic performance business cycle report of december 2020;2020;WIFO Bulletin;ideas.repec.org;https://ideas.repec.org/a/wfo/wblltn/y2020i13p123-129.html;;91;16.12.2021 01:42;;;;;;;;;0;0;0;1;1;As measures to contain the COVID-19 pandemic were relaxed in the third quarter, the global economy recovered. However, the negative correlation between lockdown intensity and economic growth weakened. Rather, the extent of the previous economic slump proved to …;;
0;SM Barker; wave of emergency lockdown measures at its peak in italy covid-19 claimed 919 lives in one day as the measures continued into a third month the wider economic ;2020;;dspace.library.uu.nl;https://dspace.library.uu.nl/handle/1874/400016;;98;16.12.2021 01:42;;;;;;;;;0;0;0;1;1;On the 9th March 2020 the Italian president Giuseppe Conte placed the country in lockdown as a preventative measure against the threat of the growing COVID-19 virus. As the first western democracy to restrict the movement of an entire country this move sparked what …;https://dspace.library.uu.nl/bitstream/handle/1874/400016/Barker,%20Sarah.pdf?sequence=1;https://scholar.google.com/scholar?q=related:nwxjNeFLn74J:scholar.google.com/&scioq=intitle:%22covid+19%22+intitle:lockdown+intitle:economic&hl=en&as_sdt=2007
0;S Bagdi;an analysis of the socio-economic impact of covid-19 lockdown on unorganized migrant workers in india;2020;… JOURNAL OF HISTORY, SCIENCE, ECONOMIC …;103.160.129.43;https://103.160.129.43/index.php/agpe/article/view/34;;99;16.12.2021 01:42;;;;;;;;;0;0;0;1;1;This paper discusses various issues of migrant workers in India due to Covid-19 lockdown. This study found that the family income of the villages is dependent on agriculture and migrant workers. The rural areas of the country lack improved agricultural land, education …;https://103.160.129.43/index.php/agpe/article/download/34/31;
0;C Chambers;  covid-19 after the virus make sure youve read the inflationary playbook the global economic machine has taken a battering from the lockdown and part of the ;2020;Engineering & Technology;ieeexplore.ieee.org;https://ieeexplore.ieee.org/abstract/document/9450532/;;101;16.12.2021 01:42;;;;;;;;;0;0;0;1;1;MoneyMarkets: COVID-19 After the virus, make sure you've read the inflationary playbook: The global economic machine has taken a battering from the lockdown, and part of the recovery will involve inflation. How well placed are engineers and technologists to ride out …;;
0;M Dauvin, B Ducoudré, É Heyer, P Madec, M Plane, ...;evaluation as of 26 june 2020 of the economic impact of the covid-19 pandemic and of the lockdown and end-of-lockdown measures in france;2020;Revue de l' …;cairn-int.info;https://www.cairn-int.info/article-E_REOF_166_0111--evaluation-as-of-26-june-2020-of-the.htm;;102;16.12.2021 01:42;;;;;;;;;0;0;0;6;1;We analyse the effects of the Covid-19 pandemic and the resulting containment measures on economic activity, employment and the income of economic agents during the period from 17 March 2020 to 5 July 2020. The eight weeks of lockdown led to a 32% contraction in …;;
0;JZ Mtaturu;lockdown effect of covid-19 pandemic on the firms economic performance implications for dar es salaam stock market;2020;;College of Business Education.;;;126;16.12.2021 01:42;CITATION;;;;;;;;0;0;0;1;1;;;
0;A Kaur, H Kaur;the social-economic impact of lockdown globally due to covid-19 pandemic;2020;Solid State Technology;solidstatetechnology.us;http://solidstatetechnology.us/index.php/JSST/article/view/1468;;127;16.12.2021 01:42;CITATION;;;;;;;;0;0;0;2;1;… The COVID-19 pandemic has resulted in 2.2 million confirmed cases worldwide by 18 April, 2020 out of … Organisation) announced COVID-19 outbreak as a global emergency on 30th January 2020[1]. In order to … summarized the effects of COVID-19 on individual …;;
0;A Bhuiyan, S Najmuj, MD Griffiths, MA Mamun;covid-19 related suicides in bangladesh due to lockdown and economic factors;2020;case study evidence from media …;;;;128;16.12.2021 01:42;CITATION;;;;;;;;0;0;0;4;1;;;
0;R Gani, L Brown, R Kapoor;covid 19-what is the health-economic economically justifiable price of lockdown;2020;Value in Health;pesquisa.bvsalud.org;https://pesquisa.bvsalud.org/global-literature-on-novel-coronavirus-2019-ncov/resource/pt/covidwho-1098151;;129;16.12.2021 01:42;CITATION;;;;;;;;0;0;0;3;1;"(instance:"" regional"") AND (year_cluster:("" 2002"") AND pais_afiliacao:(""^ iUnited States^ eEstados""))(instance:"" regional"") AND (year_cluster:("" 2002"") AND pais_afiliacao:(""^ iUnited States^ eEstados""))(instance:"" regional"") AND (year_cluster:("" 2002"") AND pais_afiliacao:("" …";;
0;CC Emeali, EI Idemobi, BU Oganezi, GC Mgbemena;cattle rearing business challenges and prospects for post-covid-19-lockdown economic recovery and sustainable development of south-east nigeria;;journal.iujharkhand.edu.in;;http://journal.iujharkhand.edu.in/Dec-2020/Cattle-Rearing-Business.pdf;;87;16.12.2021 01:42;PDF;;;;;;;;0;0;0;4;;This study looked at the business of cattle rearing in the 21st century Nigeria with particular reference to the southeast region. The broad objective of the study is to critically assess cattle rearing business in Nigeria vis-à-vis its challenges, prospects and implications for post …;http://journal.iujharkhand.edu.in/Dec-2020/Cattle-Rearing-Business.pdf;https://scholar.google.com/scholar?q=related:EqoufXI33qwJ:scholar.google.com/&scioq=intitle:%22covid+19%22+intitle:lockdown+intitle:economic&hl=en&as_sdt=2007
0;RS Devhade, SP Gaikwad;economic effects of covid-19 lockdown period in india;;researchgate.net;;https://www.researchgate.net/profile/Saurabh-Gaikwad-4/publication/351613790_Economic_effects_of_COVID-19_Lockdown_Period_in_India/links/60a0caab458515c26595f760/Economic-effects-of-COVID-19-Lockdown-Period-in-India.pdf;;88;16.12.2021 01:42;PDF;;;;;;;;0;0;0;2;;The economic impact of the 2019-20 corona virus pandemic in India has been large disruptive. With COVID-19 now spreading in India, voluminous consequences to health and livelihoods are feared, and government has imposed a 21-days national lockdown to control …;https://www.researchgate.net/profile/Saurabh-Gaikwad-4/publication/351613790_Economic_effects_of_COVID-19_Lockdown_Period_in_India/links/60a0caab458515c26595f760/Economic-effects-of-COVID-19-Lockdown-Period-in-India.pdf;https://scholar.google.com/scholar?q=related:WDK5q1KNloIJ:scholar.google.com/&scioq=intitle:%22covid+19%22+intitle:lockdown+intitle:economic&hl=en&as_sdt=2007
0;HA WRITER;the socio-economic impact of covid-19 lockdown on crime among nigeria youths;;projectstore.com.ng;;https://projectstore.com.ng/the-socio-economic-impact-of-covid-19-lockdown-on-crime-among-nigeria-youths/;;92;16.12.2021 01:42;;;;;;;;;0;0;0;1;;The impact of Covid-19 lockdown on the socio-economic implications is enormous. Confining youths in one place can force them to engage in cyber-crime. Covid-19 lockdown can also results in child molestations and expose them to gender base violence especially …;;
0;BS CHANDEL, AK DIXIT, A SINGH, A DEVI;economic analysis of the impact of covid-19 lockdown on indian dairy sector;;researchgate.net;;https://www.researchgate.net/profile/Anil-Dixit-3/publication/347555654_Economic_Analysis_of_the_Impact_of_COVID-19_Lockdown_on_Indian_Dairy_Sector/links/5fe1b4a292851c13fead948f/Economic-Analysis-of-the-Impact-of-COVID-19-Lockdown-on-Indian-Dairy-Sector.pdf;;93;16.12.2021 01:42;PDF;;;;;;;;0;0;0;4;;Indian dairy sector is the world's largest smallholder milk production system producing 187.7 million tonnes (MT) of milk where about seventy percent of the milk is produced by small holders having 1-3 animals per household. Not only this, the scale of milk production per …;https://www.researchgate.net/profile/Anil-Dixit-3/publication/347555654_Economic_Analysis_of_the_Impact_of_COVID-19_Lockdown_on_Indian_Dairy_Sector/links/5fe1b4a292851c13fead948f/Economic-Analysis-of-the-Impact-of-COVID-19-Lockdown-on-Indian-Dairy-Sector.pdf;https://scholar.google.com/scholar?q=related:qVGv_xZDOGsJ:scholar.google.com/&scioq=intitle:%22covid+19%22+intitle:lockdown+intitle:economic&hl=en&as_sdt=2007
0;EA Ndaguba;economic impediment of covid-19 lockdown on airbnb performance in cape town neighbourhood;;researchgate.net;;https://www.researchgate.net/profile/Emeka-Ndaguba/publication/352243932_ECONOMIC_IMPEDIMENT_OF_COVID-19_LOCKDOWN_ON_AIRBNB_PERFORMANCE_IN_CAPE_TOWN_NEIGHBOURHOOD/links/60c025c9a6fdcc51281601d4/ECONOMIC-IMPEDIMENT-OF-COVID-19-LOCKDOWN-ON-AIRBNB-PERFORMANCE-IN-CAPE-TOWN-NEIGHBOURHOOD.pdf;;95;16.12.2021 01:42;PDF;;;;;;;;0;0;0;1;;Some economies are shrinking, while others are experiencing downtime due to the spread of the coronavirus disease pandemic. Social integration and rural development are weakened in municipalities in South Africa as a result of government mediated approach for …;https://www.researchgate.net/profile/Emeka-Ndaguba/publication/352243932_ECONOMIC_IMPEDIMENT_OF_COVID-19_LOCKDOWN_ON_AIRBNB_PERFORMANCE_IN_CAPE_TOWN_NEIGHBOURHOOD/links/60c025c9a6fdcc51281601d4/ECONOMIC-IMPEDIMENT-OF-COVID-19-LOCKDOWN-ON-AIRBNB-PERFORMANCE-IN-CAPE-TOWN-NEIGHBOURHOOD.pdf;https://scholar.google.com/scholar?q=related:4Tf_65g5NW8J:scholar.google.com/&scioq=intitle:%22covid+19%22+intitle:lockdown+intitle:economic&hl=en&as_sdt=2007
0;AM Iorganda, M Matei;working from home in romania during covid-19 lockdown across occupations and economic sectors;;researchgate.net;;https://www.researchgate.net/profile/Mihaela_Matei2/publication/354637626_Working_from_home_in_Romania_during_COVID-19_lockdown_across_occupations_and_economic_sectors/links/616636a48ad119749b0e1e6f/Working-from-home-in-Romania-during-COVID-19-lockdown-across-occupations-and-economic-sectors.pdf;;96;16.12.2021 01:42;PDF;;;;;;;;0;0;0;2;;Based on novel household data, we document the status of working from home in Romania during the 2020 COVID-19 pandemic. Remote work had a sharp increase during the lockdown, showcasing significant differences among different categories of workers' …;https://www.researchgate.net/profile/Mihaela_Matei2/publication/354637626_Working_from_home_in_Romania_during_COVID-19_lockdown_across_occupations_and_economic_sectors/links/616636a48ad119749b0e1e6f/Working-from-home-in-Romania-during-COVID-19-lockdown-across-occupations-and-economic-sectors.pdf;
0;M Griffiths;covid-19-related suicides in bangladesh due to lockdown and economic factors case study evidence;;researchgate.net;;https://www.researchgate.net/profile/Mohammed-Mamun-5/publication/341230569_COVID-19-related_suicides_in_Bangladesh_due_to_lockdown_and_economic_factors_Case_study_evidence/links/5eb4c85a4585152169be7d92/COVID-19-related-suicides-in-Bangladesh-due-to-lockdown-and-economic-factors-Case-study-evidence.pdf;;97;16.12.2021 01:42;PDF;;;;;;;;0;0;0;1;;The incidence and mortality of the coronavirus-19 disease (COVID-19) has increased dramatically around the world. The effects of COVID-19 pandemic are not limited to health, but also have a major impact on the social and economic aspects. Meanwhile, developing …;https://www.researchgate.net/profile/Mohammed-Mamun-5/publication/341230569_COVID-19-related_suicides_in_Bangladesh_due_to_lockdown_and_economic_factors_Case_study_evidence/links/5eb4c85a4585152169be7d92/COVID-19-related-suicides-in-Bangladesh-due-to-lockdown-and-economic-factors-Case-study-evidence.pdf;https://scholar.google.com/scholar?q=related:02xN-MX2-igJ:scholar.google.com/&scioq=intitle:%22covid+19%22+intitle:lockdown+intitle:economic&hl=en&as_sdt=2007
0;I Jahan, FR Himel, MN Amin;impact of covid-19 lockdown on socio-economic conditions of semi-skilled returnee migrant workers of bangladesh;;ijsshr.in;;https://ijsshr.in/v4i5/Doc/3.pdf;;100;16.12.2021 01:42;PDF;;;;;;;;0;0;0;3;;The study explores immediate impact of COVID-19 lockdown on socio-economic conditions of the returnee migrants in Bangladesh. Using digital platform the study collects primary data through survey on returnee migrants of Bangladesh, and it follows descriptive mode of …;https://ijsshr.in/v4i5/Doc/3.pdf;https://scholar.google.com/scholar?q=related:OhAb2-ap1ekJ:scholar.google.com/&scioq=intitle:%22covid+19%22+intitle:lockdown+intitle:economic&hl=en&as_sdt=2007
0;D Guan, H Zhang, J Yan, P Li, R Shibasaki, W Li, ...;spatio-temporal analysis on epidemic versus economic performances of covid-19 lockdown;;;;;;125;16.12.2021 01:42;CITATION;;;;;;;;0;0;0;7;;;;https://scholar.google.com/scholar?q=related:N019uLQT3ycJ:scholar.google.com/&scioq=intitle:%22covid+19%22+intitle:lockdown+intitle:economic&hl=en&as_sdt=2007
0;A Atalan;correspondence about is the lockdown important to prevent the covid-19 pandemic effects on psychology environment and economy-perspective;2021;Annals of Medicine and Surgery;ncbi.nlm.nih.gov;https://www.ncbi.nlm.nih.gov/pmc/PMC8016533;;13;16.12.2021 01:40;HTML;;;;;;;;0;0;0;1;1;We are really appreciated to get an opportunity to make necessary revision for my article. Criticisms and comments are of course very valuable in terms of correcting our shortcomings and mistakes. We have tried to accurately answer the reviewer's questions and comments …;https://www.ncbi.nlm.nih.gov/pmc/PMC8016533;https://scholar.google.com/scholar?q=related:wxa-M8pIFpMJ:scholar.google.com/&scioq=intitle:%22covid+19%22+intitle:lockdown+intitle:economy&hl=en&as_sdt=2007
0;M Chitiga-Mabugu, M Henseler, R Mabugu, ...;the impact of the covid-19 enforced lockdown and fiscal package on the south african economy and environment a preliminary analysis;2021;Environment and …;cambridge.org;https://www.cambridge.org/core/journals/environment-and-development-economics/article/impact-of-the-covid19-enforced-lockdown-and-fiscal-package-on-the-south-african-economy-and-environment-a-preliminary-analysis/01F4E2ADF038CE2D35EECEA932C73CA6;;16;16.12.2021 01:40;;;;;;;;;0;0;0;4;1;This paper offers a quantitative assessment of the impacts of the COVID-19 pandemic-induced lockdown and government fiscal plan, containing 'green'elements on the economy and the environment of South Africa. The analysis uses a dynamic computable general …;;
0;S Shokoohyar, ...;exploring the heated debate over reopening for economy or continuing lockdown for public health safety concerns about covid-19 in twitter;2021;… Journal of Business …;inderscienceonline.com;https://www.inderscienceonline.com/doi/abs/10.1504/IJBSR.2021.117316;;19;16.12.2021 01:40;;10.1504/IJBSR.2021.117316;;;;;;;0;0;0;2;1;This paper explores US residents' opinion regarding whether to reopen for the economy or to continue lockdown for public health safety concerns, by analysing 1.3 million unique COVID-19-related tweets that are collected from March 11, 2020, through June 8, 2020 …;;
0;OC Robinson;correspondence about is the lockdown important to prevent the covid-19 pandemic effects on psychology environment and economy-perspective from vol 56;2021;Annals of Medicine and Surgery;ncbi.nlm.nih.gov;https://www.ncbi.nlm.nih.gov/pmc/articles/PMC7989067/;;25;16.12.2021 01:40;;;;;;;;;0;0;0;1;1;This is a PDF file of an article that has undergone enhancements after acceptance, such as the addition of a cover page and metadata, and formatting for readability, but it is not yet the definitive version of record. This version will undergo additional copyediting, typesetting and …;;
0;S Bhadury, V Kamate, S Nath;impact of covid-19 pandemic risk and lockdown on the indian economy;2021;Environmental, Social, and …;emerald.com;https://www.emerald.com/insight/content/doi/10.1108/S1571-03862021000029B032/full/html;;26;16.12.2021 01:40;;10.1108/S1571-03862021000029B032;;;;;;;0;0;0;3;1;The study provides medium-term estimates of recovery paths for Indian economy using a dynamic factor (DF)-based approach that employs data on high-frequency indicators à la Bhadury, Ghosh, and Kumar (2020). The DFs are used to analyze the post-pandemic …;;
0;SS Gill;governance structure and punjab economy under and post-covid 19 lockdown;2021;Covid-19 Pandemic and Economic Development;Springer;https://link.springer.com/chapter/10.1007/978-981-16-4442-9_20;;34;16.12.2021 01:40;;10.1007/978-981-16-4442-9_20;;;;;;;0;0;0;1;1;The unprecedented situation created by COVID-19 pandemic the regional economy of Punjab has been hit hard as it has happened globally because of disruption of supply chains, interruption in production systems, and fall in demand due to fall of income of the …;;
0;E Wylie;the impact of covid-19 and the lockdown on the uk economy;2021;;scholarship.rollins.edu;https://scholarship.rollins.edu/honors/147/;;36;16.12.2021 01:40;;;;;;;;;0;0;0;1;1;This thesis analyses the macroeconomic impacts of Covid-19 and the lockdown on the UK's economy. GDP in the second quarter of 2020 fell by 19%, the largest quarterly decrease in GDP for the UK on record. Consumption and investment in this quarter decreased …;https://scholarship.rollins.edu/cgi/viewcontent.cgi?article=1155&context=honors;https://scholar.google.com/scholar?q=related:SU3TnsAGNPUJ:scholar.google.com/&scioq=intitle:%22covid+19%22+intitle:lockdown+intitle:economy&hl=en&as_sdt=2007
